news_id;news_title;news_link;news_subtit;news_title_en;polarity;subjectivity;LV;EP;20M;PAV;ARA;PA;EM;LR;ABC
EM;"Mostovói: ""Me bastaron quince minutos para ver que Isco era buenísimo""";http://www.elmundo.es/deportes/futbol/2017/11/13/5a097b3022601d65258b4667.html;;"Mostovói: ""Fifteen minutes were enough to see that Isco was great""";0,4;0,625;[0, 0];[0, 0];[0, 0];[0, 0];[0, 0];[0, 0];[0, 0];[0, 0];[0, 0]
EM;Italia, un histórico en urgencias;http://www.elmundo.es/deportes/futbol/2017/11/13/5a08bac546163fac288b45ff.html;;Italy, a historic in the emergency room;0,0;0,0;[0, 0];[0, 0];[0, 0];[0, 0];[0, 0];[0, 0];[0, 0];[0, 0];[0, 0]
EM;Soluciones de responsabilidad social para las pymes;http://potenciatupyme.elmundo.es/video/soluciones-de-rse-para-pymes;;Social responsibility solutions for SMEs;0,0333;0,0667;[0, 0];[0, 0];[0, 0];[0, 0];[0, 0];[0, 0];[0, 0];[0, 0];[0, 0]
LR;La lista que encabezará Puigdemont se llamará Junts per Catalunya;http://www.larazon.es//espana/el-pdecat-busca-concurrir-con-la-lista-de-puigdemont-pero-no-via-grupo-de-electores-GP16913588;El nombre de la candidatura no incluye pues la denominación de PDeCAT, pese a que el partido es el promotor de la iniciativa;The list that will lead Puigdemont will be called Junts per Catalunya;0,0;0,0;[1, 85];[2, 85];[1, 85];[2, 62];[1, 68];[0, 0];[1, 81];[0, 0];[0, 0]
LR;ERC admite ahora que el Govern no estaba preparado para la independencia;http://www.larazon.es//espana/erc-admite-que-el-govern-no-estaba-preparado-para-hacer-efectiva-la-independencia-MP16914866;Ver vídeo;ERC now admits that the Government was not prepared for independence;0,0;0,0;[0, 0];[0, 0];[1, 86];[4, 94];[0, 0];[1, 64];[1, 93];[0, 0];[0, 0]
LR;EL 6-O y la DUI desmovilizan al separatismo;http://www.larazon.es//espana/el-6-o-y-la-dui-desmovilizan-al-separatismo-BO16907710;;6-O and DUI demobilize separatism;0,0;0,0;[0, 0];[0, 0];[0, 0];[0, 0];[0, 0];[0, 0];[0, 0];[0, 0];[0, 0]
LR;Dastis teme que la injerencia rusa continúe en Cataluña el 21D;http://www.larazon.es//espana/el-gobierno-denuncia-ante-la-ue-la-injerencia-rusa-en-la-crisis-de-cataluna-GP16915636;Ver vídeo;Dastis fears that Russian interference will continue in Catalonia on 21D;0,0;0,0;[0, 0];[0, 0];[0, 0];[0, 0];[0, 0];[0, 0];[0, 0];[0, 0];[0, 0]
LR;Caza a los «españolistas» en Cataluña a través de Telegram;http://www.larazon.es//espana/caza-al-espanol-en-telegram-FO16907323;;Hunting the «Spanishistas» in Catalonia through Telegram;0,0;0,0;[0, 0];[0, 0];[0, 0];[0, 0];[0, 0];[0, 0];[0, 0];[0, 0];[0, 0]
LR;Puigdemont dice ahora que una solución diferente a la independencia es «posible»;http://www.larazon.es//espana/puigdemont-dice-ahora-que-una-solucion-diferente-a-la-independencia-es-posible-FO16909738;Ver vídeo;"Puigdemont now says that a different solution to independence is ""possible""";0,0;0,8;[1, 83];[1, 92];[1, 94];[3, 82];[1, 82];[0, 0];[0, 0];[0, 0];[1, 94]
LR;La resistencia de los gemelos Vilamala;http://www.larazon.es//espana/la-resistencia-de-los-gemelos-vilamala-MG16897821;;The resistance of the Vilamala twins;0,0;0,0;[0, 0];[0, 0];[0, 0];[0, 0];[0, 0];[0, 0];[0, 0];[0, 0];[0, 0]
LR;Colau: «No soy independentista, la ruptura con el PSC es una cuestión de democracia»;http://www.larazon.es//espana/colau-no-soy-independentista-la-ruptura-con-psc-es-cuestion-de-democracia-BP16910089;Ver vídeo;"Colau: ""I am not an independentist, the break with the PSC is a matter of democracy""";0,0;0,0;[1, 69];[0, 0];[0, 0];[1, 65];[0, 0];[0, 0];[0, 0];[0, 0];[1, 80]
LR;El apunte de Francisco Marhuenda: «La descomposición del frente independentista»;http://www.larazon.es//opinion/columnistas/el-apunte-de-francisco-marhuenda-la-descomposicion-del-frente-independentista-KP16910802;;The note by Francisco Marhuenda: «The decomposition of the independence front»;0,0;0,0;[0, 0];[0, 0];[0, 0];[0, 0];[0, 0];[0, 0];[0, 0];[0, 0];[0, 0]
LR;Lamela confirma las órdenes de captura contra los exconsellers Serret y Comín;http://www.larazon.es//espana/lamela-confirma-las-ordenes-de-captura-contra-los-exconsellers-serret-y-comin-IP16914581;;Lamela confirms the arrest warrants against former Serret and Comin;-0,025;0,0;[0, 0];[0, 0];[0, 0];[1, 85];[1, 71];[0, 0];[0, 0];[0, 0];[0, 0]
LR;Santamaría: «El independentismo es un negocio para algunos y una ruina para Cataluña»;http://www.larazon.es//espana/santamaria-el-independentismo-es-un-negocio-para-algunos-y-una-ruina-para-cataluna-CP16912624;Ver vídeo;Santamaría: «The independence movement is a business for some and a ruin for Catalonia»;0,0;0,0;[0, 0];[0, 0];[0, 0];[0, 0];[1, 76];[0, 0];[0, 0];[0, 0];[0, 0]
LR;Forcadell: de las alpargatas al abrigo de lujo;http://www.larazon.es//espana/forcadell-de-las-alpargatas-al-abrigo-de-lujo-OG16897911;;Forcadell: from the espadrilles to the luxury coat;0,0;0,0;[0, 0];[0, 0];[0, 0];[0, 0];[1, 78];[0, 0];[0, 0];[0, 0];[0, 0]
LR;Rajoy cree que los separatistas pierden apoyos y que tras el 21D «llegará la calma»;http://www.larazon.es//espana/rajoy-cree-que-los-separatistas-pierden-apoyos-y-que-tras-el-21d-llegara-la-calma-PP16912481;;Rajoy believes that the separatists lose support and that after 21D «calm will come»;0,0;0,0;[0, 0];[0, 0];[0, 0];[0, 0];[0, 0];[0, 0];[0, 0];[0, 0];[1, 75]
LR;Directo | Forcadell vuelve al trabajo tras su noche en prisión;http://www.larazon.es//espana/los-manifestantes-cortan-varias-calles-de-barcelona-para-pedir-la-libertad-del-govern-HM16836188;Ver vídeo;Direct | Forcadell returns to work after his night in prison;0,1;0,4;[0, 0];[0, 0];[0, 0];[0, 0];[0, 0];[0, 0];[0, 0];[0, 0];[0, 0]
LR;«La manada» se declara inocente;http://www.larazon.es//sociedad/la-manada-se-declara-inocente-por-la-supuesta-violacion-grupal-en-los-sanfermines-EP16914330;Ver vídeo;«The pack» pleads innocent;0,5;0,7;[1, 67];[0, 0];[1, 83];[0, 0];[0, 0];[0, 0];[0, 0];[0, 0];[0, 0]
LR;Un devastador terremoto causa más de 400 muertos en el oeste de Irán;http://www.larazon.es//internacional/un-terremoto-de-7-2-grados-sacude-la-frontera-entre-irak-e-iran-LO16903338;Ver vídeo;A devastating earthquake causes more than 400 deaths in western Iran;-0,1667;0,5;[0, 0];[0, 0];[1, 63];[2, 62];[0, 0];[1, 69];[1, 67];[0, 0];[0, 0]
LR;La Audiencia archiva la causa a los padres de Nadia por exhibicionismo y pornografía;http://www.larazon.es//sociedad/la-audiencia-archiva-la-causa-a-los-padres-de-nadia-por-exhibicionismo-y-pornografia-BP16912535;;The Court files the case to Nadia's parents for exhibitionism and pornography;0,0;0,0;[1, 83];[1, 66];[1, 85];[0, 0];[1, 88];[0, 0];[0, 0];[0, 0];[1, 89]
LR;El FMI mejora cinco décimas su previsión de   crecimiento  para España en 2017;http://www.larazon.es//economia/el-fmi-mejora-cinco-decimas-su-prevision-de-crecimiento-para-espana-en-2017-HP16911789;Ver vídeo;The IMF improves its growth forecast for Spain by five tenths in 2017;0,0;0,0;[0, 0];[0, 0];[0, 0];[0, 0];[0, 0];[0, 0];[0, 0];[0, 0];[2, 130]
LR;Rioboo: «Al bolsillo de Pablo Iglesias llega dinero de Venezuela»;http://www.larazon.es//espana/un-antiguo-socio-de-iglesias-le-acusa-de-fundar-podemos-con-dinero-de-venezuela-e-iran-PP16911439;Ver vídeo;Rioboo: «Pablo Iglesias pocket comes money from Venezuela»;0,0;0,0;[0, 0];[0, 0];[1, 69];[0, 0];[0, 0];[0, 0];[0, 0];[0, 0];[0, 0]
LR;ACS obtiene un beneficio neto de 603 millones hasta septiembre, un 5,8% más;http://www.larazon.es//economia/acs-obtiene-un-beneficio-neto-de-603-millones-hasta-septiembre-un-5-8-mas-FP16917222;;ACS obtains a net profit of 603 million until September, 5.8% more;0,25;0,25;[0, 0];[0, 0];[0, 0];[0, 0];[0, 0];[0, 0];[0, 0];[0, 0];[0, 0]
LR;Discriminación salarial desde hace más de 26 años;http://www.larazon.es//espana/discriminacion-salarial-desde-hace-mas-de-26-anos-EO16907267;;Salary discrimination for more than 26 years;0,5;0,5;[0, 0];[0, 0];[0, 0];[0, 0];[0, 0];[0, 0];[0, 0];[0, 0];[0, 0]
LR;Vallas de 700 kilos para ampliar las aceras de Gran Vía en Navidad;http://www.larazon.es//local/madrid/vallas-de-700-kilos-para-ampliar-las-aceras-de-gran-via-en-navidad-FP16911136;Ver vídeo;Fences of 700 kilos to extend the sidewalks of Gran Vía at Christmas;0,0;0,0;[0, 0];[0, 0];[0, 0];[0, 0];[0, 0];[0, 0];[0, 0];[0, 0];[0, 0]
LR;El Corte Inglés contratará a 8.700 personas para reforzar la campaña de Navidad;http://www.larazon.es//economia/el-corte-ingles-contratara-a-8-700-personas-para-reforzar-la-campana-de-navidad-DP16916544;;El Corte Inglés will hire 8,700 people to reinforce the Christmas campaign;0,0;0,0;[0, 0];[0, 0];[1, 100];[0, 0];[0, 0];[1, 100];[0, 0];[0, 0];[0, 0]
LR;Hallan muertos a una anciana y su hijo en su piso de Badia del Vallés (Barcelona);http://www.larazon.es//sociedad/hallan-dos-cuerpos-con-signos-de-violencia-en-un-piso-de-barcelona-LP16914807;Ver vídeo;An old woman and her son are found dead in their apartment in Badia del Vallés (Barcelona);-0,05;0,3;[1, 62];[1, 86];[1, 81];[0, 0];[0, 0];[0, 0];[0, 0];[0, 0];[0, 0]
LR;Sarkozy hace llorar a su esposa en televisión con un romántico mensaje;http://www.larazon.es//lifestyle/gente/nicolas-sarkozy-hace-llorar-a-carla-bruni-en-television-con-un-romantico-mensaje-LP16914359;;Sarkozy makes his wife cry on television with a romantic message;0,0;0,5;[0, 0];[0, 0];[0, 0];[0, 0];[0, 0];[0, 0];[0, 0];[0, 0];[0, 0]
LR;Matilde Solís dice que el psiquiatra Javier Criado abusó sexualmente de ella;http://www.larazon.es//lifestyle/gente/matilde-solis-exesposa-del-duque-de-alba-dice-que-el-psiquiatra-javier-criado-abuso-sexualmente-de-ella-CP16917566;;Matilde Solís says that the psychiatrist Javier Criado sexually abused her;0,5;0,8333;[0, 0];[0, 0];[1, 95];[0, 0];[0, 0];[1, 84];[0, 0];[0, 0];[0, 0]
LR;Arévalo cuenta toda la verdad sobre su problema con Bertín;http://www.larazon.es//tv-y-comunicacion/tv-news/arevalo-cuenta-toda-la-verdad-sobre-su-problema-con-bertin-osborne-EP16912420;;Arévalo tells the whole truth about his problem with Bertin;0,2;0,4;[0, 0];[0, 0];[0, 0];[0, 0];[1, 67];[0, 0];[0, 0];[0, 0];[0, 0]
LR;Micky Molina reaparece irreconocible en televisión;http://www.larazon.es//tv-y-comunicacion/tv-news/micky-molina-reaparece-irreconocible-en-television-GP16915120;Galería;Micky Molina reappears unrecognizable on television;0,0;0,0;[0, 0];[0, 0];[0, 0];[0, 0];[0, 0];[0, 0];[0, 0];[0, 0];[0, 0]
LR;Correos estudia contratar 10.000 personas por el «efecto Amazon»;http://www.larazon.es//economia/correos-estudia-contratar-10-000-personas-por-el-efecto-amazon-HO16906760;;"Correos studies hiring 10,000 people for the ""Amazon effect""";0,0;0,0;[0, 0];[0, 0];[0, 0];[0, 0];[0, 0];[0, 0];[0, 0];[0, 0];[0, 0]
LR;Mueren dos turistas aplastados por un elefante en Zambia;http://www.larazon.es//sociedad/mueren-dos-turistas-aplastados-por-un-elefante-en-zambia-NO16909589;;Two tourists crushed by an elephant die in Zambia;-0,1;0,1;[0, 0];[0, 0];[0, 0];[0, 0];[0, 0];[0, 0];[0, 0];[0, 0];[1, 89]
LR;Dieta mediterránea contra el cáncer de próstata;http://www.larazon.es//atusalud/dieta-mediterranea-contra-el-cancer-de-prostata-AO16904774;;Mediterranean diet against prostate cancer;0,0;0,0;[0, 0];[0, 0];[0, 0];[0, 0];[0, 0];[0, 0];[0, 0];[0, 0];[0, 0]
LR;«Danielle», así es el nuevo anuncio de la Loteria de Navidad 2017;http://www.larazon.es//sociedad/loteria-de-navidad/danielle-y-daniel-asi-es-el-nuevo-anuncio-de-la-loteeria-de-navidad-MP16910491;Ver vídeo;«Danielle», that's the new announcement of the Christmas Lottery 2017;0,1364;0,4545;[1, 81];[1, 90];[1, 91];[0, 0];[0, 0];[1, 91];[1, 76];[0, 0];[3, 224]
LR;Un 27,4 % de jóvenes cree que la violencia machista es «normal» en la pareja;http://www.larazon.es//sociedad/un-27-4-de-jovenes-cree-que-la-violencia-machista-es-normal-en-la-pareja-BP16917170;;"27.4% of young people believe that sexist violence is ""normal"" in the couple";0,125;0,525;[0, 0];[0, 0];[1, 100];[0, 0];[0, 0];[0, 0];[1, 75];[0, 0];[0, 0]
LR;Encuentran muerto al cuñado de Gareth Bale;http://www.larazon.es//lifestyle/gente/encuentran-muerto-al-cunado-de-gareth-bale-EP16913362;;They find the dead brother of Gareth Bale;-0,2;0,4;[1, 100];[1, 86];[1, 69];[0, 0];[0, 0];[0, 0];[0, 0];[0, 0];[0, 0]
LR;Congo: La pesadilla que Bélgica quiere esconder;http://www.larazon.es//cultura/la-pesadilla-de-congo-que-belgica-quiere-esconder-OG16896459;;Congo: The nightmare that Belgium wants to hide;0,2;0,1;[0, 0];[0, 0];[0, 0];[0, 0];[0, 0];[0, 0];[0, 0];[0, 0];[0, 0]
LR;Los hoplitas y el derecho a llevar armas de bronce;http://www.larazon.es//cultura/los-hoplitas-y-el-derecho-a-llevar-armas-de-bronce-CG16896433;;Hoplites and the right to carry bronze weapons;0,2857;0,5357;[0, 0];[0, 0];[0, 0];[0, 0];[0, 0];[0, 0];[0, 0];[0, 0];[0, 0]
LR;La atroz pesadilla de Paracuellos;http://www.larazon.es//cultura/la-atroz-pesadilla-de-paracuellos-KG16896408;Cientos de presos fueron sacados de las cárceles de Madrid el 7 de noviembre de 1936 con un destino concreto: ser fusilados y arrojados a fosas comunes.;The atrocious nightmare of Paracuellos;-0,7;1,0;[0, 0];[0, 0];[0, 0];[0, 0];[0, 0];[0, 0];[0, 0];[0, 0];[0, 0]
LR;El chiringuito de Pedrerol: «Lo mejor de Isco está por llegar»;http://www.larazon.es//deportes/chiringuito/el-chiringuito-de-pedrerol-lo-mejor-de-isco-esta-por-llegar-GO16908835;La selección nos ha devuelto a todos la esperanza liderada por el futbolista del Madrid y por Lopetegui, que se deshace en elogios hacia el crack malagueño.;The Pedrerol chiringuito: «The best of Isco is yet to come»;1,0;0,3;[0, 0];[0, 0];[0, 0];[0, 0];[0, 0];[0, 0];[0, 0];[0, 0];[0, 0]
LR;El país 93;http://www.larazon.es//deportes/chiringuito/el-pais-93-CO16908785;;The country 93;0,0;0,0;[2, 88];[0, 0];[0, 0];[0, 0];[0, 0];[1, 88];[0, 0];[0, 0];[0, 0]
LR;Ésta sí es mi España;http://www.larazon.es//deportes/chiringuito/esta-si-es-mi-espana-JO16908760;;This is my Spain;0,0;0,0;[2, 64];[2, 61];[3, 63];[0, 0];[0, 0];[4, 64];[1, 67];[0, 0];[4, 250]
LR;La pizarra: La orquesta está afinada;http://www.larazon.es//deportes/chiringuito/la-pizarra-la-orquesta-esta-afinada-DO16908586;;The blackboard: The orchestra is tuned;0,0;0,0;[0, 0];[0, 0];[0, 0];[0, 0];[0, 0];[0, 0];[0, 0];[0, 0];[0, 0]
LR;Italia, frente al «apocalipsis»;http://www.larazon.es//deportes/chiringuito/italia-frente-al-apocalipsis-NO16908511;;"Italy, against the ""apocalypse""";0,0;0,0;[0, 0];[0, 0];[0, 0];[0, 0];[0, 0];[0, 0];[0, 0];[0, 0];[0, 0]
LR;Griezmann, tienes que volver ya;http://www.larazon.es//deportes/chiringuito/griezmann-tienes-que-volver-ya-CO16908486;;Griezmann, you have to go back;0,0;0,0;[0, 0];[0, 0];[0, 0];[0, 0];[0, 0];[0, 0];[0, 0];[0, 0];[0, 0]
LR;Alonso, ante un gran reto;http://www.larazon.es//deportes/chiringuito/alonso-ante-un-gran-reto-OO16908431;;Alonso, facing a great challenge;0,8;0,75;[0, 0];[0, 0];[0, 0];[0, 0];[0, 0];[0, 0];[0, 0];[0, 0];[1, 65]
LR;Un legado eterno;http://www.larazon.es//deportes/chiringuito/un-legado-eterno-CG16897173;;An eternal legacy;0,0;0,0;[0, 0];[0, 0];[0, 0];[0, 0];[0, 0];[0, 0];[0, 0];[0, 0];[0, 0]
LR;Viaje de amor;http://www.larazon.es//opinion/columnistas/viaje-de-amor-NO16905329;Me recuerda al principio de una novela de Stephan Leacock: «La tormenta era terrible en el norte de Escocia....;Journey of love;0,5;0,6;[0, 0];[0, 0];[0, 0];[0, 0];[0, 0];[0, 0];[0, 0];[0, 0];[0, 0]
LR;May, más cerca de la salida;http://www.larazon.es//opinion/el-puntazo/may-mas-cerca-de-la-salida-JO16905840;;May, closer to the exit;0,0;0,0;[0, 0];[0, 0];[0, 0];[0, 0];[0, 0];[0, 0];[0, 0];[0, 0];[0, 0]
LR;Que se haga justicia;http://www.larazon.es//opinion/el-puntazo/que-se-haga-justicia-PO16905820;;Let justice be done;0,0;0,0;[0, 0];[0, 0];[0, 0];[0, 0];[0, 0];[0, 0];[0, 0];[0, 0];[0, 0]
LR;El fin de las «reválidas Wert»;http://www.larazon.es//opinion/el-puntazo/el-fin-de-las-revalidas-wert-NO16905800;;The end of the «Wert revalidation»;0,0;0,0;[0, 0];[1, 63];[1, 61];[0, 0];[0, 0];[0, 0];[0, 0];[0, 0];[0, 0]
LR;«Forcadell, una Juana de Arco que pasó una noche en la cárcel»;http://www.larazon.es//multimedia/el-videoblog-de-marhuenda/el-analisis-de-marhuenda-forcadell-una-juana-de-arco-que-paso-una-noche-en-la-carcel-MH16888589;Ver vídeo;«Forcadell, a Joan of Arc who spent a night in jail»;-0,1;0,1;[0, 0];[0, 0];[0, 0];[0, 0];[0, 0];[0, 0];[0, 0];[0, 0];[0, 0]
LR;Colau elige el independentismo;http://www.larazon.es//opinion/editorial/colau-elige-el-independentismo-KO16905780;;Colau chooses independence;0,0;0,0;[1, 63];[3, 63];[2, 63];[7, 63];[1, 63];[2, 63];[2, 63];[0, 0];[2, 126]
LR;Fistro mío;http://www.larazon.es//opinion/columnistas/fistro-mio-IO16905409;Clara Ponsatí, sí. La misma que hace dos semanas, en las ruedas de prensa, evitaba con sorna el idioma...;Fistra mine;0,0;0,0;[0, 0];[0, 0];[0, 0];[0, 0];[0, 0];[0, 0];[0, 0];[0, 0];[0, 0]
LR;Aznar, más guapo calladito;http://www.larazon.es//opinion/columnistas/aznar-mas-guapo-calladito-KO16905429;Samaranch es inolvidable. Para mí y para todos los que le conocimos. Un catalán español y un español...;Aznar, more handsome, calladito;0,5;0,75;[0, 0];[0, 0];[0, 0];[0, 0];[0, 0];[0, 0];[0, 0];[0, 0];[0, 0]
LR;La democracia de las emociones;http://www.larazon.es//opinion/columnistas/la-democracia-de-las-emociones-LO16905349;Si partimos de la máxima de Chur-chill, «la democracia es el menos malo de los sistemas políticos», estamos...;The democracy of emotions;0,0;0,0;[0, 0];[0, 0];[0, 0];[0, 0];[0, 0];[0, 0];[0, 0];[0, 0];[0, 0]
LR;Echar tierra a los ojos;http://www.larazon.es//opinion/columnistas/echar-tierra-a-los-ojos-OO16905496;La sociedad europea está perdida en medio de un túnel a oscuras y, desde él, no es posible ver una rendija...;Put dirt in your eyes;0,0;0,0;[0, 0];[0, 0];[0, 0];[0, 0];[0, 0];[0, 0];[0, 0];[0, 0];[0, 0]
LR;ERC admite ahora que el Govern no estaba preparado para la independencia;http://www.larazon.es//espana/erc-admite-que-el-govern-no-estaba-preparado-para-hacer-efectiva-la-independencia-MP16914866;Ver vídeo;ERC now admits that the Government was not prepared for independence;0,0;0,0;[0, 0];[0, 0];[1, 86];[4, 94];[0, 0];[1, 64];[1, 93];[0, 0];[0, 0]
LR;Dastis teme que la injerencia rusa continúe en Cataluña el 21D;http://www.larazon.es//espana/el-gobierno-denuncia-ante-la-ue-la-injerencia-rusa-en-la-crisis-de-cataluna-GP16915636;Ver vídeo;Dastis fears that Russian interference will continue in Catalonia on 21D;0,0;0,0;[0, 0];[0, 0];[0, 0];[0, 0];[0, 0];[0, 0];[0, 0];[0, 0];[0, 0]
LR;La CUP ve posible sumar a Fachin si asume un programa «independentista y rupturista»;http://www.larazon.es//espana/la-cup-ve-posible-sumar-a-fachin-si-asume-un-programa-independentista-y-rupturista-NP16914768;;"The CUP sees it possible to join Fachin if it assumes a ""separatist and separatist"" program";0,0;1,0;[0, 0];[0, 0];[0, 0];[0, 0];[0, 0];[1, 61];[0, 0];[0, 0];[0, 0]
LR;Nadal asegura que el Congreso Mundial de Móviles de Barcelona no está en peligro;http://www.larazon.es//espana/nadal-asegura-que-el-congreso-mundial-de-moviles-de-barcelona-no-esta-en-peligro-HP16914553;;Nadal assures that the Barcelona Mobile World Congress is not in danger;0,0;0,0;[1, 62];[0, 0];[0, 0];[0, 0];[2, 79];[0, 0];[0, 0];[0, 0];[0, 0]
LR;Rajoy cree que los separatistas pierden apoyos y que tras el 21D «llegará la calma»;http://www.larazon.es//espana/rajoy-cree-que-los-separatistas-pierden-apoyos-y-que-tras-el-21d-llegara-la-calma-PP16912481;;Rajoy believes that the separatists lose support and that after 21D «calm will come»;0,0;0,0;[0, 0];[0, 0];[0, 0];[0, 0];[0, 0];[0, 0];[0, 0];[0, 0];[1, 75]
LR;Trump propone a un exdirectivo de la industria farmacéutica como secretario de Sanidad;http://www.larazon.es//internacional/trump-propone-a-un-exdirectivo-de-la-industria-farmaceutica-como-secretario-de-sanidad-AP16916413;;Trump proposes a former director of the pharmaceutical industry as Secretary of Health;0,0;0,0;[0, 0];[0, 0];[0, 0];[0, 0];[0, 0];[0, 0];[0, 0];[0, 0];[0, 0]
LR;La UE respalda el embargo de armas a Venezuela y las sanciones selectivas;http://www.larazon.es//internacional/la-ue-respalda-embargo-de-armas-a-venezuela-y-las-sanciones-selectivas-MO16909885;;The EU supports the arms embargo on Venezuela and selective sanctions;0,0;0,0;[0, 0];[0, 0];[1, 66];[0, 0];[0, 0];[0, 0];[0, 0];[0, 0];[0, 0]
LR;Macron abre en el Estadio de Francia los homenajes por los atentados del 13-N;http://www.larazon.es//internacional/macron-abre-en-el-estadio-de-francia-los-homenajes-por-los-atentados-del-13-n-AO16909845;;Macron opens tributes at the Stade de France for the attacks of 13-N;0,0;0,0;[0, 0];[0, 0];[0, 0];[0, 0];[0, 0];[0, 0];[0, 0];[0, 0];[0, 0]
LR;Herido por fuego norcoreano un soldado que trataba de desertar al sur;http://www.larazon.es//internacional/heridos-por-fuego-norcoreano-un-soldado-que-trataba-de-desertar-al-sur-EO16909692;;Wounded by North Korean fire a soldier trying to defect to the south;0,0;0,0;[0, 0];[1, 80];[0, 0];[0, 0];[0, 0];[1, 82];[0, 0];[0, 0];[1, 87]
LR;La CIA y el FBI obligan a rectificar a Trump;http://www.larazon.es//internacional/la-cia-y-el-fbi-obligan-a-rectificar-a-trump-IO16907087;;The CIA and the FBI force to rectify Trump;0,0;0,0;[0, 0];[0, 0];[0, 0];[0, 0];[0, 0];[0, 0];[0, 0];[0, 0];[0, 0]
LR;Nueva revuelta contra May en una semana clave del Brexit;http://www.larazon.es//internacional/nueva-revuelta-contra-may-en-una-semana-clave-del-brexit-LO16907059;;New revolt against May in a key week of Brexit;0,0682;0,7273;[0, 0];[0, 0];[0, 0];[0, 0];[0, 0];[0, 0];[0, 0];[0, 0];[0, 0]
LR;Bruselas prepara un «plan B» por si descarrila el Brexit;http://www.larazon.es//internacional/bruselas-prepara-un-plan-b-por-si-descarrila-el-brexit-FO16907031;;"Brussels prepares a ""plan B"" in case it derails the Brexit";0,0;0,0;[0, 0];[0, 0];[0, 0];[0, 0];[0, 0];[0, 0];[0, 0];[0, 0];[0, 0]
LR;Hariri promete «volver muy pronto»;http://www.larazon.es//internacional/hariri-promete-volver-muy-pronto-HO16907000;;"Hariri promises to ""come back very soon""";0,1;0,15;[0, 0];[0, 0];[0, 0];[0, 0];[1, 67];[0, 0];[0, 0];[0, 0];[0, 0]
LR;El Corte Inglés contratará a 8.700 personas para reforzar la campaña de Navidad;http://www.larazon.es//economia/el-corte-ingles-contratara-a-8-700-personas-para-reforzar-la-campana-de-navidad-DP16916544;;El Corte Inglés will hire 8,700 people to reinforce the Christmas campaign;0,0;0,0;[0, 0];[0, 0];[1, 100];[0, 0];[0, 0];[1, 100];[0, 0];[0, 0];[0, 0]
LR;Amazon lanza el «Black Friday» con dos semanas con descuentos de hasta el 40%;http://www.larazon.es//economia/amazon-lanza-el-black-friday-con-dos-semanas-con-descuentos-de-hasta-el-40-GP16911016;;Amazon launches «Black Friday» with two weeks with discounts of up to 40%;0,0;0,0;[0, 0];[0, 0];[0, 0];[0, 0];[0, 0];[0, 0];[0, 0];[0, 0];[0, 0]
LR;La prima de riesgo cae a 112 puntos básicos al cierre;http://www.larazon.es//economia/la-prima-de-riesgo-cae-a-112-puntos-basicos-al-cierre-BP16917240;;The risk premium falls to 112 basis points at closing;0,0;0,0;[0, 0];[0, 0];[0, 0];[0, 0];[0, 0];[0, 0];[0, 0];[0, 0];[0, 0]
LR;«La manada» se declara inocente;http://www.larazon.es//sociedad/la-manada-se-declara-inocente-por-la-supuesta-violacion-grupal-en-los-sanfermines-EP16914330;Ver vídeo;«The pack» pleads innocent;0,5;0,7;[1, 67];[0, 0];[1, 83];[0, 0];[0, 0];[0, 0];[0, 0];[0, 0];[0, 0]
LR;Condenada a más de ocho años por prostituir y obligar a mendigar a sus hijas;http://www.larazon.es//sociedad/condenada-a-mas-de-ocho-anos-por-prostituir-y-obligar-a-mendigar-a-sus-hijas-CP16915304;;Sentenced to more than eight years for prostituting and forcing to beg her daughters;0,5;0,5;[0, 0];[0, 0];[1, 100];[0, 0];[0, 0];[0, 0];[0, 0];[0, 0];[0, 0]
LR;El magnate ruso Yuri Milner planea una misión privada para buscar vida en Encélad;http://www.larazon.es//sociedad/ciencia/el-magnate-ruso-yuri-milner-planea-una-mision-privada-para-buscar-vida-en-encelad-EP16917751;Ver vídeo;Russian tycoon Yuri Milner plans a private mission to seek life in Encylad;0,0;0,1875;[0, 0];[0, 0];[1, 71];[0, 0];[0, 0];[0, 0];[0, 0];[0, 0];[0, 0]
LR;Hallan muertos a una anciana y su hijo en su piso de Badia del Vallés (Barcelona);http://www.larazon.es//sociedad/hallan-dos-cuerpos-con-signos-de-violencia-en-un-piso-de-barcelona-LP16914807;Ver vídeo;An old woman and her son are found dead in their apartment in Badia del Vallés (Barcelona);-0,05;0,3;[1, 62];[1, 86];[1, 81];[0, 0];[0, 0];[0, 0];[0, 0];[0, 0];[0, 0]
LR;¿Por qué vuelven los recuerdos «olvidados»?;http://www.larazon.es//sociedad/ciencia/por-que-vuelven-los-recuerdos-olvidados-NO16909127;;"Why do ""forgotten"" memories come back?";0,0;0,0;[0, 0];[0, 0];[0, 0];[0, 0];[0, 0];[0, 0];[0, 0];[0, 0];[0, 0]
LR;El Bayern Múnich recuperará al médico que dimitió por Guardiola;http://www.larazon.es//deportes/el-bayern-munich-recuperara-al-medico-que-dimitio-por-guardiola-FP16912689;;Bayern Munich will recover the doctor who resigned by Guardiola;0,0;0,0;[0, 0];[0, 0];[1, 86];[0, 0];[0, 0];[0, 0];[0, 0];[0, 0];[0, 0]
LR;Bernabéu o la teoría de la jeta;http://www.larazon.es//deportes/bernabeu-o-la-teoria-de-la-jeta-JG16897196;;Bernabéu or the theory of the card;0,0;0,0;[0, 0];[0, 0];[0, 0];[0, 0];[0, 0];[0, 0];[0, 0];[0, 0];[0, 0]
LR;Márquez, otra vez campeón del mundo;http://www.larazon.es//deportes/motociclismo/marc-marquez-campeon-del-mundo-de-motogp-BO16901220;;Márquez, again world champion;0,0;0,0;[0, 0];[0, 0];[1, 89];[0, 0];[1, 62];[0, 0];[0, 0];[0, 0];[1, 62]
LR;Un mito de 24 años;http://www.larazon.es//deportes/un-mito-de-24-anos-BO16908810;;A myth of 24 years;0,0;0,0;[2, 71];[0, 0];[5, 66];[1, 62];[3, 62];[2, 62];[0, 0];[0, 0];[1, 62]
